{
  "schema_version": "2",
  "record_type": "platform_authority_lambda_invocation_inventory",
  "environment": "non-production",
  "production": false,
  "authorization_mode": "SINGLE_OPERATOR_NONPROD_EXCEPTION",
  "two_human_status": "NOT_PROVEN",
  "independent_approval_present": false,
  "single_operator_exception_digest": "sha256:d336bed30a82ce48e261b9b5465fc528b37c8b307a32e270313e33d14045175b",
  "owner_authorization_sha256": "sha256:5438bffceacd77712bde422e6d98274ec5f87285fdf2a0bbaf0d63c75da30300",
  "active_aliases": [
    "single-classify",
    "single-reconcile",
    "single-retire"
  ],
  "inventory_scope": "ALL_ENABLED_REGIONS_AND_GLOBAL_IAM",
  "authority_account_id_digest": "sha256:aaaaaaaaaaaaaaaaaaaaaaaaaaaaaaaaaaaaaaaaaaaaaaaaaaaaaaaaaaaaaaaa",
  "target_region": "us-east-1",
  "scan_id_digest": "sha256:0123456789abcdef0123456789abcdef0123456789abcdef0123456789abcdef",
  "allowlist_digest": "sha256:79951fbdb10ca53fa54f03bde9ff86309e02c32e8f35d5ee538838fcf72bad55",
  "source_template_sha256": "sha256:bbbbbbbbbbbbbbbbbbbbbbbbbbbbbbbbbbbbbbbbbbbbbbbbbbbbbbbbbbbbbbbb",
  "evidence_source_mode": "AWS_READ_ONLY",
  "source_snapshot_digest": "sha256:abababababababababababababababababababababababababababababababab",
  "collector_principal_digest": "sha256:ffffffffffffffffffffffffffffffffffffffffffffffffffffffffffffffff",
  "source_snapshot_started_at": "2030-01-01T00:24:30Z",
  "source_snapshot_completed_at": "2030-01-01T00:24:50Z",
  "status": "REVIEW_SAFE_REPORT_ONLY",
  "coverage": {
    "region_discovery": {
      "status": "COMPLETE",
      "page_count": 1,
      "item_count": 2,
      "evidence_digest": "sha256:1010101010101010101010101010101010101010101010101010101010101010"
    },
    "lambda_functions": {
      "status": "COMPLETE",
      "page_count": 2,
      "item_count": 1,
      "evidence_digest": "sha256:2020202020202020202020202020202020202020202020202020202020202020"
    },
    "lambda_aliases": {
      "status": "COMPLETE",
      "page_count": 2,
      "item_count": 3,
      "evidence_digest": "sha256:3030303030303030303030303030303030303030303030303030303030303030"
    },
    "lambda_versions": {
      "status": "COMPLETE",
      "page_count": 2,
      "item_count": 2,
      "evidence_digest": "sha256:4040404040404040404040404040404040404040404040404040404040404040"
    },
    "lambda_function_urls": {
      "status": "COMPLETE",
      "page_count": 2,
      "item_count": 3,
      "evidence_digest": "sha256:5050505050505050505050505050505050505050505050505050505050505050"
    },
    "lambda_resource_policies": {
      "status": "COMPLETE",
      "page_count": 4,
      "item_count": 6,
      "evidence_digest": "sha256:6060606060606060606060606060606060606060606060606060606060606060"
    },
    "lambda_event_source_mappings": {
      "status": "COMPLETE",
      "page_count": 2,
      "item_count": 0,
      "evidence_digest": "sha256:7070707070707070707070707070707070707070707070707070707070707070"
    },
    "iam_account_authorization": {
      "status": "COMPLETE",
      "page_count": 2,
      "item_count": 5,
      "evidence_digest": "sha256:8080808080808080808080808080808080808080808080808080808080808080"
    }
  },
  "enabled_region_count": 2,
  "scanned_region_count": 2,
  "authority_edges": [
    {
      "authority_class": "INVOCATION",
      "source_type": "LAMBDA_RESOURCE_POLICY",
      "duty": "single_operator_classifier",
      "target_scope": "EXACT_SINGLE_CLASSIFY_ALIAS",
      "action_class": "INVOKE_FUNCTION_URL",
      "condition_class": "FUNCTION_URL_AUTH_TYPE_AWS_IAM",
      "principal_kind": "EXACT_CLASSIFIER_ROLE",
      "principal_digest": "sha256:5555555555555555555555555555555555555555555555555555555555555555",
      "resource_digest": "sha256:9999999999999999999999999999999999999999999999999999999999999999",
      "source_document_digest": "sha256:dddddddddddddddddddddddddddddddddddddddddddddddddddddddddddddddd",
      "verdict": "EXPECTED_EXACT",
      "reason_code": "EXPECTED_ALLOWLIST_EDGE"
    },
    {
      "authority_class": "INVOCATION",
      "source_type": "LAMBDA_RESOURCE_POLICY",
      "duty": "single_operator_classifier",
      "target_scope": "EXACT_SINGLE_CLASSIFY_ALIAS",
      "action_class": "INVOKE_FUNCTION",
      "condition_class": "INVOKED_VIA_FUNCTION_URL_TRUE",
      "principal_kind": "EXACT_CLASSIFIER_ROLE",
      "principal_digest": "sha256:5555555555555555555555555555555555555555555555555555555555555555",
      "resource_digest": "sha256:9999999999999999999999999999999999999999999999999999999999999999",
      "source_document_digest": "sha256:dddddddddddddddddddddddddddddddddddddddddddddddddddddddddddddddd",
      "verdict": "EXPECTED_EXACT",
      "reason_code": "EXPECTED_ALLOWLIST_EDGE"
    },
    {
      "authority_class": "INVOCATION",
      "source_type": "LAMBDA_RESOURCE_POLICY",
      "duty": "single_operator_retirement",
      "target_scope": "EXACT_SINGLE_RETIRE_ALIAS",
      "action_class": "INVOKE_FUNCTION_URL",
      "condition_class": "FUNCTION_URL_AUTH_TYPE_AWS_IAM",
      "principal_kind": "EXACT_APPROVER_ROLE",
      "principal_digest": "sha256:6666666666666666666666666666666666666666666666666666666666666666",
      "resource_digest": "sha256:aaaaaaaaaaaaaaaaaaaaaaaaaaaaaaaaaaaaaaaaaaaaaaaaaaaaaaaaaaaaaaaa",
      "source_document_digest": "sha256:eeeeeeeeeeeeeeeeeeeeeeeeeeeeeeeeeeeeeeeeeeeeeeeeeeeeeeeeeeeeeeee",
      "verdict": "EXPECTED_EXACT",
      "reason_code": "EXPECTED_ALLOWLIST_EDGE"
    },
    {
      "authority_class": "INVOCATION",
      "source_type": "LAMBDA_RESOURCE_POLICY",
      "duty": "single_operator_retirement",
      "target_scope": "EXACT_SINGLE_RETIRE_ALIAS",
      "action_class": "INVOKE_FUNCTION",
      "condition_class": "INVOKED_VIA_FUNCTION_URL_TRUE",
      "principal_kind": "EXACT_APPROVER_ROLE",
      "principal_digest": "sha256:6666666666666666666666666666666666666666666666666666666666666666",
      "resource_digest": "sha256:aaaaaaaaaaaaaaaaaaaaaaaaaaaaaaaaaaaaaaaaaaaaaaaaaaaaaaaaaaaaaaaa",
      "source_document_digest": "sha256:eeeeeeeeeeeeeeeeeeeeeeeeeeeeeeeeeeeeeeeeeeeeeeeeeeeeeeeeeeeeeeee",
      "verdict": "EXPECTED_EXACT",
      "reason_code": "EXPECTED_ALLOWLIST_EDGE"
    },
    {
      "authority_class": "INVOCATION",
      "source_type": "LAMBDA_RESOURCE_POLICY",
      "duty": "single_operator_retirement",
      "target_scope": "EXACT_SINGLE_RECONCILE_ALIAS",
      "action_class": "INVOKE_FUNCTION_URL",
      "condition_class": "FUNCTION_URL_AUTH_TYPE_AWS_IAM",
      "principal_kind": "EXACT_APPROVER_ROLE",
      "principal_digest": "sha256:6666666666666666666666666666666666666666666666666666666666666666",
      "resource_digest": "sha256:bbbbbbbbbbbbbbbbbbbbbbbbbbbbbbbbbbbbbbbbbbbbbbbbbbbbbbbbbbbbbbbb",
      "source_document_digest": "sha256:ffffffffffffffffffffffffffffffffffffffffffffffffffffffffffffffff",
      "verdict": "EXPECTED_EXACT",
      "reason_code": "EXPECTED_ALLOWLIST_EDGE"
    },
    {
      "authority_class": "INVOCATION",
      "source_type": "LAMBDA_RESOURCE_POLICY",
      "duty": "single_operator_retirement",
      "target_scope": "EXACT_SINGLE_RECONCILE_ALIAS",
      "action_class": "INVOKE_FUNCTION",
      "condition_class": "INVOKED_VIA_FUNCTION_URL_TRUE",
      "principal_kind": "EXACT_APPROVER_ROLE",
      "principal_digest": "sha256:6666666666666666666666666666666666666666666666666666666666666666",
      "resource_digest": "sha256:bbbbbbbbbbbbbbbbbbbbbbbbbbbbbbbbbbbbbbbbbbbbbbbbbbbbbbbbbbbbbbbb",
      "source_document_digest": "sha256:ffffffffffffffffffffffffffffffffffffffffffffffffffffffffffffffff",
      "verdict": "EXPECTED_EXACT",
      "reason_code": "EXPECTED_ALLOWLIST_EDGE"
    },
    {
      "authority_class": "INVOCATION",
      "source_type": "IAM_ROLE_INLINE_POLICY",
      "duty": "single_operator_classifier",
      "target_scope": "EXACT_SINGLE_CLASSIFY_ALIAS",
      "action_class": "INVOKE_FUNCTION_URL",
      "condition_class": "FUNCTION_URL_AUTH_TYPE_AWS_IAM",
      "principal_kind": "EXACT_CLASSIFIER_ROLE",
      "principal_digest": "sha256:5555555555555555555555555555555555555555555555555555555555555555",
      "resource_digest": "sha256:9999999999999999999999999999999999999999999999999999999999999999",
      "source_document_digest": "sha256:1111111111111111111111111111111111111111111111111111111111111111",
      "verdict": "EXPECTED_EXACT",
      "reason_code": "EXPECTED_ALLOWLIST_EDGE"
    },
    {
      "authority_class": "INVOCATION",
      "source_type": "IAM_ROLE_INLINE_POLICY",
      "duty": "single_operator_classifier",
      "target_scope": "EXACT_SINGLE_CLASSIFY_ALIAS",
      "action_class": "INVOKE_FUNCTION",
      "condition_class": "INVOKED_VIA_FUNCTION_URL_TRUE",
      "principal_kind": "EXACT_CLASSIFIER_ROLE",
      "principal_digest": "sha256:5555555555555555555555555555555555555555555555555555555555555555",
      "resource_digest": "sha256:9999999999999999999999999999999999999999999999999999999999999999",
      "source_document_digest": "sha256:1111111111111111111111111111111111111111111111111111111111111111",
      "verdict": "EXPECTED_EXACT",
      "reason_code": "EXPECTED_ALLOWLIST_EDGE"
    },
    {
      "authority_class": "INVOCATION",
      "source_type": "IAM_ROLE_INLINE_POLICY",
      "duty": "single_operator_retirement",
      "target_scope": "EXACT_SINGLE_RETIRE_ALIAS",
      "action_class": "INVOKE_FUNCTION_URL",
      "condition_class": "FUNCTION_URL_AUTH_TYPE_AWS_IAM",
      "principal_kind": "EXACT_APPROVER_ROLE",
      "principal_digest": "sha256:6666666666666666666666666666666666666666666666666666666666666666",
      "resource_digest": "sha256:aaaaaaaaaaaaaaaaaaaaaaaaaaaaaaaaaaaaaaaaaaaaaaaaaaaaaaaaaaaaaaaa",
      "source_document_digest": "sha256:2222222222222222222222222222222222222222222222222222222222222222",
      "verdict": "EXPECTED_EXACT",
      "reason_code": "EXPECTED_ALLOWLIST_EDGE"
    },
    {
      "authority_class": "INVOCATION",
      "source_type": "IAM_ROLE_INLINE_POLICY",